{
  "glossary_version": "fleet-glossary/v1",
  "updated_at": "2026-10-24",
  "note": "機隊全專案中文用詞對照表。給人看的文字一律用 zh；retired 是不要再用的舊叫法，tests/test_fleet_glossary.py 會掃描 trade-alerts 內給人看的文字，出現就擋。英文代號只如實列出，不在這裡改。",
  "entries": [
    {
      "id": "strategy.seykota",
      "category": "策略",
      "zh": "趨勢策略",
      "en": [
        "seykota",
        "ed-seykota-systematic-trend-following",
        "SEY."
      ],
      "definition": "用 4 小時 K 線做 BTC 趨勢跟隨的策略，持倉通常比較久。",
      "retired": [
        "長線策略",
        "4 小時趨勢追蹤"
      ],
      "note": "程式裡的專案代號目前不只一個（seykota-btcusdt-4h、ed-seykota），這次只統一中文。"
    },
    {
      "id": "strategy.momentum",
      "category": "策略",
      "zh": "動能策略",
      "en": [
        "momentum",
        "mexc-4h-momentum-trailing-stop",
        "MOM."
      ],
      "definition": "抓短線急漲幣種、用移動停損出場的策略。",
      "retired": [
        "MEXC 4H 動能追蹤停損",
        "MEXC 動能"
      ],
      "note": "專案代號目前有 mexc-4h-momentum 與 mexc-4h-momentum-trailing-stop 兩個。"
    },
    {
      "id": "strategy.mycrypto",
      "category": "策略",
      "zh": "加密策略",
      "en": [
        "mycrypto",
        "my-crypto-bot",
        "MYC."
      ],
      "definition": "在 Binance 做 BTC 永續合約的策略（2026-10-17 起正式機用 Binance 主網真倉；開發機用 Binance 測試網的模擬倉）。",
      "retired": [],
      "note": "中文句子裡提到它時用「加密策略」，不要直接寫 my-crypto。"
    },
    {
      "id": "strategy.btc-competition",
      "category": "策略",
      "zh": "競賽策略",
      "en": [
        "btc-competition",
        "btc-bull-market-competition",
        "BTC."
      ],
      "definition": "在 Binance 現貨定期再平衡一籃子幣的策略。",
      "retired": [
        "BTC 牛市競賽",
        "BTC 競賽"
      ]
    },
    {
      "id": "strategy.fleet",
      "category": "策略",
      "zh": "全機隊",
      "en": [
        "fleet",
        "FLEET."
      ],
      "definition": "四支策略全部，加上共用的維運工具。",
      "retired": []
    },
    {
      "id": "host.main",
      "category": "主機",
      "zh": "正式機",
      "en": [
        "fleet-prod-tokyo",
        "161.33.186.220",
        "trading-main"
      ],
      "definition": "跑正式交易的主機這個角色，部署來源是正式機分支（operations）。實際的正式機是 Oracle 東京 A1（fleet-prod-tokyo，ARM，2 核心／12GB），2026-09-29 起使用、2026-10-04 起接手全部真倉交易，也是唯一的正式機；GCP 上的舊正式機 trading-main 已於 2026-10-24 刪除（VM、磁碟、保留 IP 都清掉了）。",
      "retired": [
        "策略主機",
        "seykota 主機",
        "momentum 主機",
        "btc 主機",
        "維運主機",
        "正式環境",
        "真倉（operations）"
      ],
      "note": "「真倉」只拿來說交易模式（用真錢），不拿來指這台主機。trading-main 已刪除，單寫「正式機」就是 A1，不必再區分新舊；既有文件裡的「A1 正式機（新）」可以保留，不強制改寫。登記冊的「已做」指 A1 上在跑。"
    },
    {
      "id": "host.dev",
      "category": "主機",
      "zh": "開發機",
      "en": [
        "fleet-standby-1",
        "168.110.15.84"
      ],
      "definition": "給開發測試用的那台主機，部署來源是開發機分支（testing）。2026-10-21 台北起是 Oracle 東京的 A1-dev（E2.1.Micro，1 OCPU／954MB，跑三支策略的測試網模擬倉、競賽、維運通知、查詢與隧道、自動監看）。",
      "retired": [
        "測試機",
        "WSL 開發機隊",
        "development／測試機"
      ],
      "note": "舊文件叫 WSL 開發機隊，之後是 GCP 上的 trading-dev（已於 2026-10-24 刪除）；兩者都已換成 A1-dev。提到歷史上 GCP 那台時寫「舊 GCP 開發機（trading-dev）」。"
    },
    {
      "id": "host.dev.dev2",
      "category": "主機",
      "zh": "A1-dev2",
      "en": [
        "fleet-standby-2",
        "161.33.222.54"
      ],
      "definition": "Oracle 東京的第二台 E2.1.Micro 小機器，是 A1-dev 的熱備援（沒裝機隊；放著 2026-10-24 舊開發機除役前的完整備份，不含金鑰）。",
      "retired": [],
      "note": "2026-10-20 建立。"
    },
    {
      "id": "host.workstation",
      "category": "主機",
      "zh": "工作機",
      "en": [],
      "definition": "使用者自己的電腦（Windows，裡面跑 WSL2 Ubuntu），用來跑 Claude 對話、開 PR 與審閱；不跑任何交易程式，也不是開發機。",
      "retired": [],
      "note": "2026-10-21 定：舊 GCP 的 trading-dev 開發機除役後（2026-10-24 已刪除），Claude 的工作環境改在這裡。"
    },
    {
      "id": "mode.live",
      "category": "交易模式",
      "zh": "真倉",
      "en": [
        "LIVE",
        "LIVE_ONLINE",
        "LIVE_TRADING",
        "ENABLE_LIVE_TRADING"
      ],
      "definition": "用真錢、下真單。",
      "retired": [
        "實盤",
        "正式實盤"
      ],
      "note": "真錢開關目前各策略名稱不同：動能策略叫 LIVE_TRADING，其他三支叫 ENABLE_LIVE_TRADING。"
    },
    {
      "id": "mode.demo",
      "category": "交易模式",
      "zh": "模擬倉",
      "en": [
        "DEMO",
        "testnet"
      ],
      "definition": "下單到交易所提供的模擬帳戶，不動真錢。",
      "retired": [
        "模擬盤",
        "測試網模擬倉"
      ]
    },
    {
      "id": "mode.paper",
      "category": "交易模式",
      "zh": "紙上模擬",
      "en": [
        "DRY_RUN",
        "DRY_RUN_ONLINE",
        "PAPER",
        "BTC_COMP_PAPER"
      ],
      "definition": "完全不下單，只在本機記錄「如果下單會怎樣」。",
      "retired": [
        "模擬演練",
        "本地紙上模擬"
      ],
      "note": "DRY_RUN_ONLINE 在各策略的實際做法還要逐支核對，核對後若有策略其實會下單到模擬帳戶，改歸「模擬倉」。"
    },
    {
      "id": "branch.operations",
      "category": "分支",
      "zh": "正式機分支",
      "en": [
        "operations"
      ],
      "definition": "正式機部署時拿的程式版本。登記冊的「已做」就是看這條分支上有沒有。",
      "retired": [
        "營運版"
      ]
    },
    {
      "id": "branch.testing",
      "category": "分支",
      "zh": "開發機分支",
      "en": [
        "testing"
      ],
      "definition": "開發機部署時拿的程式版本。",
      "retired": []
    },
    {
      "id": "branch.development",
      "category": "分支",
      "zh": "開發主幹",
      "en": [
        "development"
      ],
      "definition": "PR 合併進來的地方；合併到這裡還不代表已經上任何一台主機。",
      "retired": []
    },
    {
      "id": "branch.default",
      "category": "分支",
      "zh": "預設分支",
      "en": [
        "main",
        "master"
      ],
      "definition": "GitHub 上的預設分支，各 repo 有的叫 main、有的叫 master。",
      "retired": []
    },
    {
      "id": "repair.bot",
      "category": "修復機器人",
      "zh": "修復機器人",
      "en": [
        "scripts/repair_bot.py",
        "scripts/repair_bot_shadow.py",
        "*-repair-shadow.service"
      ],
      "definition": "定時檢查「交易所已經平倉、本地帳本卻漏記」的情況，並提出或直接補寫修復。動能策略、趨勢策略各有一支。",
      "retired": [
        "修復 bot",
        "影子版",
        "影子 bot",
        "抓錯機器人",
        "自動修復 bot"
      ],
      "note": "systemd 服務名稱仍叫 *-repair-shadow（歷史名稱），動能策略那支其實已經是完整版。"
    },
    {
      "id": "repair.detect_propose",
      "category": "修復機器人",
      "zh": "抓錯並提出修復建議",
      "en": [
        "VERIFIED_CLOSE_PROPOSED",
        "repair_bot.detect_propose"
      ],
      "definition": "修復機器人的第一個功能：找出漏記平倉、算好修復方案，但不自己動帳本。",
      "retired": [
        "影子模式"
      ]
    },
    {
      "id": "repair.auto_apply",
      "category": "修復機器人",
      "zh": "自動補寫漏記平倉",
      "en": [
        "MOMENTUM_REPAIR_AUTO_APPLY",
        "VERIFIED_CLOSE_AUTO_REPAIRED",
        "repair_bot.verified_close"
      ],
      "definition": "修復機器人的第二個功能：證據完全沒有疑慮時，直接照交易所紀錄把漏記的平倉寫進帳本。",
      "retired": []
    },
    {
      "id": "repair.pause",
      "category": "修復機器人",
      "zh": "修復機器人停用開關",
      "en": [
        "MOMENTUM_REPAIR_PAUSED",
        "SEYKOTA_REPAIR_PAUSED",
        "repair_bot.pause_brake"
      ],
      "definition": "修復機器人的第三個功能：一個設定就讓它完全停手（不檢查、不查交易所、不寫帳本）。",
      "retired": [
        "緊急煞車",
        "煞車"
      ]
    },
    {
      "id": "repair.shared_runner",
      "category": "修復機器人",
      "zh": "共用修復執行器",
      "en": [
        "trade_alerts.repair_runner",
        "trade_alerts.verified_close_backfill",
        "v2-W2"
      ],
      "definition": "動能策略、趨勢策略共用的同一份修復程式（trade_alerts.repair_runner）；兩支各自的修復機器人只負責接上自己的帳本與交易所。已在正式機 A1 上跑。",
      "retired": [
        "共用執行器"
      ]
    },
    {
      "id": "event.missed_close",
      "category": "事件",
      "zh": "漏記平倉",
      "en": [
        "verified close",
        "orphan close"
      ],
      "definition": "交易所上那筆倉位已經平掉了，本地帳本卻沒有記到平倉。",
      "retired": [
        "孤兒平倉",
        "孤兒單"
      ]
    },
    {
      "id": "safety.halt",
      "category": "安全機制",
      "zh": "安全暫停",
      "en": [
        "SAFE_HALT",
        "latch",
        "safe_halt"
      ],
      "definition": "出事時策略自己停下來、不再下任何新單，等人確認後才解除。",
      "retired": [
        "停擺",
        "緊急停止",
        "緊急暫停",
        "熔斷"
      ],
      "note": "「熔斷」只保留給將來可能做的「單日虧損上限」，不拿來指安全暫停。「停機」也不要再拿來指安全暫停，但因為會誤抓「暫停機制」這類詞，自動檢查不擋，靠人工留意。"
    },
    {
      "id": "safety.entry_pause",
      "category": "安全機制",
      "zh": "暫停新進場",
      "en": [
        "MOMENTUM_ENTRY_PAUSED"
      ],
      "definition": "只擋新開倉，已經有的倉位照常保護和對帳。",
      "retired": [
        "保護型暫停"
      ]
    },
    {
      "id": "safety.resume",
      "category": "安全機制",
      "zh": "解除工具",
      "en": [
        "seykota-resume",
        "btc-competition-resume",
        "src/safe_halt_resume.py"
      ],
      "definition": "解除安全暫停用的兩段式指令：先預覽拿確認碼，再帶確認碼解除。",
      "retired": []
    },
    {
      "id": "safety.confirm_code",
      "category": "安全機制",
      "zh": "確認碼",
      "en": [
        "fingerprint"
      ],
      "definition": "解除安全暫停時要貼回去的那串碼，確保解除的正是眼前這一次暫停。",
      "retired": [
        "指紋"
      ]
    },
    {
      "id": "reconcile",
      "category": "對帳",
      "zh": "對帳",
      "en": [
        "reconcile",
        "ledger_status.json",
        "google_reconcile_status.json"
      ],
      "definition": "比對本地帳本、交易所、Google 表三邊的紀錄是否一致。",
      "retired": [
        "持倉同步"
      ],
      "note": "「核對」當一般動詞（去交易所核對部位）可以用；指「帳本↔交易所／Google 表的比對」這件事時一律叫「對帳」。自動檢查不擋「核對」。"
    },
    {
      "id": "ledger",
      "category": "對帳",
      "zh": "帳本",
      "en": [
        "trading_ledger.jsonl"
      ],
      "definition": "每支策略在本機記錄每筆交易的檔案。",
      "retired": []
    },
    {
      "id": "google_sheet",
      "category": "對帳",
      "zh": "Google 表",
      "en": [
        "Google Sheet「AI自動程式交易紀錄」"
      ],
      "definition": "四支策略共用、給人看的交易紀錄試算表。",
      "retired": [
        "Google 交易紀錄"
      ],
      "note": "LINE 查詢選單的「交易紀錄」是另一個東西，不要混用。"
    },
    {
      "id": "funding_sync",
      "category": "對帳",
      "zh": "資金費同步",
      "en": [
        "reconcile.funding_fee_sync",
        "sync_funding_fees"
      ],
      "definition": "定時查交易所的資金費結算紀錄、寫進本機帳本。",
      "retired": [
        "資金費用"
      ]
    },
    {
      "id": "notify.event_log",
      "category": "通知",
      "zh": "事件日誌",
      "en": [
        "fleet_event_log.jsonl",